Date,Article_title,Stock_symbol,Url,Publisher,Author,Article,Lsa_summary,Luhn_summary,Textrank_summary,Lexrank_summary
2017-12-22 00:00:00 UTC,"AMD Shares Down 4.5%, NVIDIA Shares Down Nearly 2%; Some Traders Attributing Weakness To Decline In Bitcoin/Other Cryptocurrencies",NVDA,https://www.benzinga.com/movers/17/12/10950985/amd-shares-down-4-5-nvidia-shares-down-nearly-2-some-traders-attributing-weakn,Paul Quintaro,,,,,,
2017-12-21 00:00:00 UTC,"Jim Cramer Advises His Viewers On Groupon, Buckle And More",NVDA,https://www.benzinga.com/media/cnbc/17/12/10943110/jim-cramer-advises-his-viewers-on-groupon-buckle-and-more,Craig Jones,,,,,,
2017-12-19 00:00:00 UTC,"Watching Semi/Chip Stocks Following Micron Earnings Beat, Strong Q2 Guidance; Western Digital Shares Up 1%, Intel, AMD Up 0.5%, NVIDIA Up 0.4%",NVDA,https://www.benzinga.com/news/17/12/10936009/watching-semichip-stocks-following-micron-earnings-beat-strong-q2-guidance-weste,Paul Quintaro,,,,,,
2017-12-17 00:00:00 UTC,"Benzinga's Weekly Bulls & Bears: Bitcoin, Ford, Lululemon, Nike And More",NVDA,https://www.benzinga.com/short-sellers/17/12/10925110/benzingas-weekly-bulls-bears-bitcoin-ford-lululemon-nike-and-more,Nelson Hem,,,,,,
2017-12-15 00:00:00 UTC,"NVIDIA May Reportedly Offer Short-Term, Unsecured Commercial Paper Notes Of Up To $575M",NVDA,https://www.benzinga.com/news/financing/17/12/10923717/nvidia-may-reportedly-offer-short-term-unsecured-commercial-paper-note,Hal Lindon,,,,,,
2017-12-13 00:00:00 UTC,NVIDIA Late Tuesday Announced Partnership With Japanese Construction Co. Komatsu,NVDA,https://www.benzinga.com/news/contracts/17/12/10909152/nvidia-late-tuesday-announced-partnership-with-japanese-construction-c,Hal Lindon,,,,,,
2017-12-13 00:00:00 UTC,"ICYMI: MoviePass' Unexpected New Partner, Venture Capitalist Makes A Pair Of Calls, Premarket Prep's Bitcoin Special",NVDA,https://www.benzinga.com/news/17/12/10906546/icymi-moviepass-unexpected-new-partner-venture-capitalist-makes-a-pair-of-calls-,Taylor Cox,,,,,,
2017-12-12 00:00:00 UTC,"Short Seller Claims 'If You Want Something Bitcoin-Related, Digital Power Isn't It'",NVDA,https://www.benzinga.com/trading-ideas/long-ideas/17/12/10905024/short-seller-claims-if-you-want-something-bitcoin-related-di,Elizabeth Balboa,,,,,,
2017-12-12 00:00:00 UTC,What's Up With Nvidia?,NVDA,https://www.benzinga.com/media/cnbc/17/12/10903998/whats-up-with-nvidia,Jayson Derrick,,,,,,
2017-12-12 00:00:00 UTC,UPDATE: Social Capital's Chamath Palihapitiya On CNBC Said NVIDIA Could Be A Short In Chip Space,NVDA,https://www.benzinga.com/media/cnbc/17/12/10902653/update-social-capitals-chamath-palihapitiya-on-cnbc-said-nvidia-could-be-a,Paul Quintaro,,,,,,
2017-12-12 00:00:00 UTC,"Social Capital's Chamath Palihapitiya Currently On CNBC Discussing Chip Cos. Cautiously; Could Explain Move Lower In NVIDIA, AMD",NVDA,https://www.benzinga.com/media/cnbc/17/12/10902524/social-capitals-chamath-palihapitiya-currently-on-cnbc-discussing-chip-cos,Paul Quintaro,,,,,,
2017-12-12 00:00:00 UTC,UPDATE: NVIDIA Shares Down 1.2% In Pre-Market Trade; Not Yet Seeing Any News To Justify Move Lower,NVDA,https://www.benzinga.com/movers/17/12/10902522/update-nvidia-shares-down-1-2-in-pre-market-trade-not-yet-seeing-any-news-to-j,Paul Quintaro,,,,,,
2017-12-12 00:00:00 UTC,"NVIDIA Shares Fall ~$3 In Pre-Market Action, Touch Low At $190.75",NVDA,https://www.benzinga.com/movers/17/12/10902488/nvidia-shares-fall-3-in-pre-market-action-touch-low-at-190-75,Paul Quintaro,,,,,,
2017-12-11 00:00:00 UTC,AI In Focus: 3 Pure-Play Stocks That Hold Promise,NVDA,https://www.benzinga.com/news/17/12/10897436/ai-in-focus-3-pure-play-stocks-that-hold-promise,Zacks,,,,,,
2017-12-09 00:00:00 UTC,How 3 College Students Turned $500K Into $2.6 Million In 4 Weeks,NVDA,https://www.benzinga.com/news/17/12/10893094/how-3-college-students-turned-500k-into-2-6-million-in-4-weeks,Spencer Israel,,,,,,
2017-12-09 00:00:00 UTC,"ICYMI: Digital Power Shares Sink On News, Unexpected Winners From A Tesla Report, And Will Bitcoin Go Boom Or Bust?",NVDA,https://www.benzinga.com/news/17/12/10893913/icymi-digital-power-shares-sink-on-news-unexpected-winners-from-a-tesla-report-a,Taylor Cox,,,,,,
2017-12-08 00:00:00 UTC,"UPDATE: Loup's Bohlig Tells Benzinga If Other OEMs Bring Development Of A.I. Chips For Autonomous In-House He Would Reconsider NVIDIA Thesis, But Most Will Likely 'Leave chip development to the experts.'",NVDA,https://www.benzinga.com/analyst-ratings/analyst-color/17/12/10891686/update-loups-bohlig-tells-benzinga-if-other-oems-bring-,Hal Lindon,,,,,,
2017-12-08 00:00:00 UTC,"UPDATE: Loup Ventures' Bohlig Tells Benzinga Tesla Is Just One Potential Customer' For NVIDIA, Every Autonomous Car 'Will eventually need to integrate NVDA or similar competitor chips'",NVDA,https://www.benzinga.com/analyst-ratings/analyst-color/17/12/10891685/update-loup-ventures-bohlig-tells-benzinga-tesla-is-jus,Hal Lindon,,,,,,
2017-12-08 00:00:00 UTC,"Loup Ventures' Austin Bohlig Tells Benzinga NVIDIA Likely Unhurt If Tesla Develops Its Own A.I. Chips, Says: 'Unless Tesla is going to be the only car sold in 10 years, I don't see this as a negative to the [NVIDIA] thesis.'",NVDA,https://www.benzinga.com/analyst-ratings/analyst-color/17/12/10891684/loup-ventures-austin-bohlig-tells-benzinga-nvidia-likel,Hal Lindon,,,,,,
2017-12-08 00:00:00 UTC,"Tesla Developing Its Own AI Chip, Analyst Says Chipmakers Could Gain Manufacturing Contracts",NVDA,https://www.benzinga.com/analyst-ratings/analyst-color/17/12/10891008/tesla-developing-its-own-ai-chip-analyst-says-chipmaker,Elizabeth Balboa,,,,,,
2017-12-08 00:00:00 UTC,"UPDATE: Tigress' Feinseth Tells Benzinga He Believes Tesla Wants To Collaborate With NVIDIA or Skyworks Solutions, Says 'Tesla's not going to, in theory, buy a chip factory'",NVDA,https://www.benzinga.com/analyst-ratings/analyst-color/17/12/10891191/update-tigress-feinseth-tells-benzinga-he-believes-tesl,Hal Lindon,,,,,,
2017-12-08 00:00:00 UTC,"Tigress Financial's Ivan Feinseth Reacts To Report Tesla Designing Its Own A.I. Chip For Vehicles, Tells Benzinga He Believes If Tesla Is Designing Chip Will Likely 'Go to somebody like NVIDIA or Skyworks to work on actually making the chip.'",NVDA,https://www.benzinga.com/analyst-ratings/analyst-color/17/12/10891190/tigress-financials-ivan-feinseth-reacts-to-report-tesla,Hal Lindon,,,,,,
2017-12-08 00:00:00 UTC,"Tesla Shares Up Slightly Pre-Market Following Electrek Report Co. Working On Its Own A.I. Chip For Autonomous Vehicles, Potentially Impactful For Nvidia, Skyworks Solutions Among Others",NVDA,https://www.benzinga.com/news/17/12/10890748/tesla-shares-up-slightly-pre-market-following-electrek-report-co-working-on-its-,Hal Lindon,,,,,,
2017-12-08 00:00:00 UTC,"NVIDIA Announces TITAN V, World's Most Powerful GPU for the PC",NVDA,https://www.benzinga.com/news/17/12/10889697/nvidia-announces-titan-v-worlds-most-powerful-gpu-for-the-pc,Charles Gross,,,,,,
2017-12-07 00:00:00 UTC,One Big Reason Why Tech Stocks Are Not In The 'Dot-Com Bubble',NVDA,https://www.benzinga.com/news/17/12/10880589/one-big-reason-why-tech-stocks-are-not-in-the-dot-com-bubble,Zacks,,,,,,
2017-12-05 00:00:00 UTC,"Rotation, Rotation, Rotation: Value Is The New Tech",NVDA,https://www.benzinga.com/short-sellers/17/12/10874386/rotation-rotation-rotation-value-is-the-new-tech,Elizabeth Balboa,,,,,,
2017-12-05 00:00:00 UTC,VentureBeat Reports 'Nvidia launches Shield TV set-top box in China with remastered Nintendo titles',NVDA,https://www.benzinga.com/news/17/12/10873901/venturebeat-reports-nvidia-launches-shield-tv-set-top-box-in-china-with-remaster,Eddie Staley,,,,,,
2017-12-05 00:00:00 UTC,Has Weakness In Semiconductor Stocks Made It Time To Buy?,NVDA,https://www.benzinga.com/markets/17/12/10869742/has-weakness-in-semiconductor-stocks-made-it-time-to-buy,Zacks,,,,,,
2017-12-05 00:00:00 UTC,"Nvidia Shares Have Moved +4.1% Over Last 10 Minutes, Now Up 2.5% At $191.37",NVDA,https://www.benzinga.com/movers/17/12/10872868/nvidia-shares-have-moved-4-1-over-last-10-minutes-now-up-2-5-at-191-37,Hal Lindon,,,,,,
2017-12-04 00:00:00 UTC,Vetr Upgrades Nvidia,NVDA,https://www.benzinga.com/analyst-ratings/upgrades/17/12/10869310/vetr-upgrades-nvidia,Spencer White,,,,,,
2017-12-04 00:00:00 UTC,Seeing 2nd Notable Block Trade In NVIDIA In After Hours Session Of 3.3M Shares At $186.48/Share,NVDA,https://www.benzinga.com/news/17/12/10868715/seeing-2nd-notable-block-trade-in-nvidia-in-after-hours-session-of-3-3m-shares-a,Eddie Staley,,,,,,
2017-12-04 00:00:00 UTC,Seeing Notable Block Trade In NVIDIA of 3.3M Shares At $186.66/Share,NVDA,https://www.benzinga.com/news/17/12/10868632/seeing-notable-block-trade-in-nvidia-of-3-3m-shares-at-186-66share,Eddie Staley,,,,,,
2017-12-04 00:00:00 UTC,Back The Blockchain With This ETF,NVDA,https://www.benzinga.com/trading-ideas/long-ideas/17/12/10863526/back-the-blockchain-with-this-etf,ETF Professor,,,,,,
2017-12-04 00:00:00 UTC,Semiconductor Stocks Are Under Heavy Selling Pressure,NVDA,https://www.benzinga.com/etfs/specialty-etfs/17/12/10867732/semiconductor-stocks-are-under-heavy-selling-pressure,Wayne Duggan,,,,,,
2017-12-04 00:00:00 UTC,"Seeing Continued Rotation/Profit-Taking In Year-to-Date Outperforming Semiconductor Stocks; AMD -5.36%, Nvidia -4.43%, Micron -3.36%, iShares Semi ETF SOXX -1.687%",NVDA,https://www.benzinga.com/movers/17/12/10867738/seeing-continued-rotationprofit-taking-in-year-to-date-outperforming-semicondu,Hal Lindon,,,,,,
2017-12-03 00:00:00 UTC,Is It Time To Remove General Electric From The Dow 30?,NVDA,https://www.benzinga.com/general/education/17/12/10834522/is-it-time-to-remove-general-electric-from-the-dow-30,Elizabeth Balboa,,,,,,
2017-12-01 00:00:00 UTC,Seeing Notable Block Trade In NVIDIA Of 3.8M Shares At $197.65/Share,NVDA,https://www.benzinga.com/news/17/12/10862222/seeing-notable-block-trade-in-nvidia-of-3-8m-shares-at-197-65share,Eddie Staley,,,,,,
2017-11-30 00:00:00 UTC,Tech ETFs And Stocks Tumble: Time To Buy?,NVDA,https://www.benzinga.com/etfs/sector-etfs/17/11/10853379/tech-etfs-and-stocks-tumble-time-to-buy,Zacks,,,,,,
2017-11-30 00:00:00 UTC,Nvidia Invests In Bay Area Artificial Intelligence Startup,NVDA,https://www.benzinga.com/fintech/17/11/10853312/nvidia-invests-in-bay-area-artificial-intelligence-startup,Dustin Blitchok,,,,,,
2017-11-30 00:00:00 UTC,"NVIDIA, Wells Fargo Lead $40M Investment Round In A.I. Startup H20.ai, An Open-Source Deep Learning Platform For Predictive Maintenance, Security, Fraud, Auditing, Etc.",NVDA,https://www.benzinga.com/news/17/11/10853970/nvidia-wells-fargo-lead-40m-investment-round-in-a-i-startup-h20-ai-an-open-sourc,Paul Quintaro,,,,,,
2017-11-29 00:00:00 UTC,Traders See Signs Of Rotation Into Financials Amid Nasdaq's Worst Day In Months,NVDA,https://www.benzinga.com/analyst-ratings/analyst-color/17/11/10847268/traders-see-signs-of-rotation-into-financials-amid-nasd,Wayne Duggan,,,,,,
2017-11-29 00:00:00 UTC,NVIDIA Shares Not Reacting As Traders Circulate Rumor Softbank Purchased Stock,NVDA,https://www.benzinga.com/news/rumors/17/11/10846118/nvidia-shares-not-reacting-as-traders-circulate-rumor-softbank-purchased-,Paul Quintaro,,,,,,
2017-11-28 00:00:00 UTC,Nikkei Publishes 'Internet of things promises sustained chip market surge'; Not Seeing Any Chip Stocks Moving On Report,NVDA,https://www.benzinga.com/news/17/11/10841363/nikkei-publishes-internet-of-things-promises-sustained-chip-market-surge-not-see,Paul Quintaro,,,,,,
2017-11-28 00:00:00 UTC,"Analyst: Bitcoin Mining Will Mean Less For Semis In 2018, AMD Is More Exposed Than Nvidia",NVDA,https://www.benzinga.com/analyst-ratings/analyst-color/17/11/10839754/analyst-bitcoin-mining-will-mean-less-for-semis-in-2018,Wayne Duggan,,,,,,
2017-11-28 00:00:00 UTC,"AMD Shares Down ~3.8% For Session Amid Comments From Mizuho Suggesting Cryptomining Will Be Less Meaningful For Co., NVIDIA In '18, John Peddie Research Highlighting AMD Is Losing Graphics Market Share Despite Vega",NVDA,https://www.benzinga.com/analyst-ratings/analyst-color/17/11/10839373/amd-shares-down-3-8-for-session-amid-comments-from-mizu,Paul Quintaro,,,,,,
2017-11-27 00:00:00 UTC,Why Nvidia Will Play An 'Integral' Role In The Future Of Tech,NVDA,https://www.benzinga.com/analyst-ratings/analyst-color/17/11/10832565/why-nvidia-will-play-an-integral-role-in-the-future-of-,Elizabeth Balboa,,,,,,
2017-11-27 00:00:00 UTC,Nuance Communications and NVIDIA to Partner to Advance Artificial Intelligence for Radiology,NVDA,https://www.benzinga.com/news/17/11/10832415/nuance-communications-and-nvidia-to-partner-to-advance-artificial-intelligence-f,Paul Quintaro,,,,,,
2017-11-27 00:00:00 UTC,Watch GE and NVIDIA After the Companies Announced a Partnership to Accelerate Artificial Intelligence in Healthcare,NVDA,https://www.benzinga.com/news/17/11/10831914/watch-ge-and-nvidia-after-the-companies-announced-a-partnership-to-accelerate-ar,Paul Quintaro,,,,,,
2017-11-21 00:00:00 UTC,"For Nvidia, Gaming Trends Could Make 2018 Another Standout Year",NVDA,https://www.benzinga.com/analyst-ratings/analyst-color/17/11/10818277/for-nvidia-gaming-trends-could-make-2018-another-stando,Jayson Derrick,,,,,,
2017-11-17 00:00:00 UTC,"There Could Be 18% Upside Left In Nvidia, Analyst Says",NVDA,https://www.benzinga.com/analyst-ratings/analyst-color/17/11/10805616/there-could-be-18-upside-left-in-nvidia-analyst-says,Wayne Duggan,,,,,,
2017-11-17 00:00:00 UTC,8 Biggest Price Target Changes For Friday,NVDA,https://www.benzinga.com/analyst-ratings/price-target/17/11/10804428/8-biggest-price-target-changes-for-friday,Lisa Levin,,,,,,
2017-11-17 00:00:00 UTC,"Canaccord Genuity Maintains Buy on NVIDIA, Raises Price Target to $250.00",NVDA,https://www.benzinga.com/news/17/11/10803893/canaccord-genuity-maintains-buy-on-nvidia-raises-price-target-to-250-00,vivek.proactive@gmail.com,,,,,,
2017-11-16 00:00:00 UTC,Todd Gordon's Nvidia Options Trade,NVDA,https://www.benzinga.com/media/cnbc/17/11/10801189/todd-gordons-nvidia-options-trade,Craig Jones,,,,,,
2017-11-16 00:00:00 UTC,Intercontinental Exchange Reports Launch Of NYSE FANG+ Index Futures Contract,NVDA,https://www.benzinga.com/news/17/11/10796874/intercontinental-exchange-reports-launch-of-nyse-fang-index-futures-contract,Paul Quintaro,,,,,,
2017-11-14 00:00:00 UTC,"Nvidia Impresses At 2017 Supercomputing Conference, KeyBanc Says",NVDA,https://www.benzinga.com/analyst-ratings/analyst-color/17/11/10779934/nvidia-impresses-at-2017-supercomputing-conference-keyb,Shanthi Rexaline,,,,,,
2017-11-13 00:00:00 UTC,Retail Investors Keep Buying This Market,NVDA,https://www.benzinga.com/news/17/11/10773149/retail-investors-keep-buying-this-market,Spencer Israel,,,,,,
2017-11-13 00:00:00 UTC,AMD Has More To Lose Than Nvidia Should Bitcoin Mining Hardware Sales Decline,NVDA,https://www.benzinga.com/analyst-ratings/analyst-color/17/11/10772395/amd-has-more-to-lose-than-nvidia-should-bitcoin-mining-,Wayne Duggan,,,,,,
2017-11-13 00:00:00 UTC,"Long-Time Nvidia Bear Upgrades Stock, Lifts Target To $200",NVDA,https://www.benzinga.com/analyst-ratings/analyst-color/17/11/10770794/long-time-nvidia-bear-upgrades-stock-lifts-target-to-20,Jayson Derrick,,,,,,
2017-11-13 00:00:00 UTC,5 Biggest Price Target Changes For Monday,NVDA,https://www.benzinga.com/analyst-ratings/price-target/17/11/10770698/5-biggest-price-target-changes-for-monday,Lisa Levin,,,,,,
2017-11-13 00:00:00 UTC,"Benzinga's Top Upgrades, Downgrades For November 13, 2017",NVDA,https://www.benzinga.com/analyst-ratings/upgrades/17/11/10770374/benzingas-top-upgrades-downgrades-for-november-13-2017,Lisa Levin,,,,,,
2017-11-13 00:00:00 UTC,BMO Capital Upgrades NVIDIA to Market Perform,NVDA,https://www.benzinga.com/news/17/11/10768776/bmo-capital-upgrades-nvidia-to-market-perform,Paul Quintaro,,,,,,
2017-11-13 00:00:00 UTC,44 Biggest Movers From Friday,NVDA,https://www.benzinga.com/news/17/11/10767774/44-biggest-movers-from-friday,Lisa Levin,,,,,,
2017-11-10 00:00:00 UTC,What Wall Street Thinks Of Nvidia's Huge Quarter,NVDA,https://www.benzinga.com/analyst-ratings/analyst-color/17/11/10764626/what-wall-street-thinks-of-nvidias-huge-quarter,Wayne Duggan,,,,,,
2017-11-10 00:00:00 UTC,35 Stocks Moving In Friday's Mid-Day Session,NVDA,https://www.benzinga.com/news/17/11/10764866/35-stocks-moving-in-fridays-mid-day-session,Lisa Levin,,,,,,
2017-11-10 00:00:00 UTC,Tap Nvidia's Growth Story With These Tech ETFs,NVDA,https://www.benzinga.com/news/earnings/17/11/10764449/tap-nvidias-growth-story-with-these-tech-etfs,Zacks,,,,,,
2017-11-10 00:00:00 UTC,"Barclays Maintains Equal-Weight on NVIDIA, Raises Price Target to $225.00",NVDA,https://www.benzinga.com/news/17/11/10764773/barclays-maintains-equal-weight-on-nvidia-raises-price-target-to-225-00,Paul Quintaro,,,,,,
2017-11-10 00:00:00 UTC,Nvidia's Q3 Success Dampens Fear Of Gaming Growth Slowdown,NVDA,https://www.benzinga.com/analyst-ratings/analyst-color/17/11/10763733/nvidias-q3-success-dampens-fear-of-gaming-growth-slowdo,Jayson Derrick,,,,,,
2017-11-10 00:00:00 UTC,"Bank of America Maintains Buy on NVIDIA, Raises Price Target to $251.00",NVDA,https://www.benzinga.com/news/17/11/10764612/bank-of-america-maintains-buy-on-nvidia-raises-price-target-to-251-00,Paul Quintaro,,,,,,
2017-11-10 00:00:00 UTC,Game On: Intel Is Targeting Nvidia And AMD's Market Share,NVDA,https://www.benzinga.com/analyst-ratings/analyst-color/17/11/10763585/game-on-intel-is-targeting-nvidia-and-amds-market-share,Shanthi Rexaline,,,,,,
2017-11-10 00:00:00 UTC,Nvidia Bears Still Exist: Wells Fargo Keeps Stock Rated Underperform,NVDA,https://www.benzinga.com/analyst-ratings/analyst-color/17/11/10763550/nvidia-bears-still-exist-wells-fargo-keeps-stock-rated-,Jayson Derrick,,,,,,
2017-11-10 00:00:00 UTC,5 Biggest Price Target Changes For Friday,NVDA,https://www.benzinga.com/analyst-ratings/price-target/17/11/10763861/5-biggest-price-target-changes-for-friday,Lisa Levin,,,,,,
2017-11-10 00:00:00 UTC,"BMO Capital Maintains Underperform on NVIDIA, Raises Price Target to $135.00",NVDA,https://www.benzinga.com/news/17/11/10763847/bmo-capital-maintains-underperform-on-nvidia-raises-price-target-to-135-00,Paul Quintaro,,,,,,
2017-11-10 00:00:00 UTC,6 Technical Levels Discussed During Friday's PreMarket Prep,NVDA,https://www.benzinga.com/trading-ideas/long-ideas/17/11/10763806/6-technical-levels-discussed-during-fridays-premarket-prep,Spencer Israel,,,,,,
2017-11-10 00:00:00 UTC,"Nvidia Is 'En Fuego,' Analyst Lifts Target Price To $225",NVDA,https://www.benzinga.com/analyst-ratings/analyst-color/17/11/10763241/nvidia-is-en-fuego-analyst-lifts-target-price-to-225,Jayson Derrick,,,,,,
2017-11-10 00:00:00 UTC,"Benzinga's Top Upgrades, Downgrades For November 10, 2017",NVDA,https://www.benzinga.com/analyst-ratings/upgrades/17/11/10763773/benzingas-top-upgrades-downgrades-for-november-10-2017,Lisa Levin,,,,,,
2017-11-10 00:00:00 UTC,"The Market In 5 Minutes: Nvidia, Roku, Star Wars, And More",NVDA,https://www.benzinga.com/news/17/11/10763721/the-market-in-5-minutes-nvidia-roku-star-wars-and-more,Benzinga Newsdesk,,,,,,
2017-11-10 00:00:00 UTC,"Loop Capital Maintains Buy on NVIDIA, Raises Price Target to $235.00",NVDA,https://www.benzinga.com/news/17/11/10763413/loop-capital-maintains-buy-on-nvidia-raises-price-target-to-235-00,Paul Quintaro,,,,,,
2017-11-10 00:00:00 UTC,"Morgan Stanley Maintains Equal-Weight on NVIDIA, Raises Price Target to $222.00",NVDA,https://www.benzinga.com/news/17/11/10763409/morgan-stanley-maintains-equal-weight-on-nvidia-raises-price-target-to-222-00,Paul Quintaro,,,,,,
2017-11-10 00:00:00 UTC,31 Stocks Moving In Friday's Pre-Market Session,NVDA,https://www.benzinga.com/news/17/11/10763397/31-stocks-moving-in-fridays-pre-market-session,Lisa Levin,,,,,,
2017-11-10 00:00:00 UTC,Here's What's Coming Up On PreMarket Prep For November 10,NVDA,https://www.benzinga.com/pre-market-outlook/17/11/10763230/heres-whats-coming-up-on-premarket-prep-for-november-10,Benzinga Newsdesk,,,,,,
2017-11-10 00:00:00 UTC,Nomura Upgrades NVIDIA to Neutral,NVDA,https://www.benzinga.com/news/17/11/10763209/nomura-upgrades-nvidia-to-neutral,Paul Quintaro,,,,,,
2017-11-10 00:00:00 UTC,A Peek Into The Markets: U.S. Stock Futures Decline Ahead Of J C Penney Earnings,NVDA,https://www.benzinga.com/news/17/11/10762940/a-peek-into-the-markets-u-s-stock-futures-decline-ahead-of-j-c-penney-earnings,Lisa Levin,,,,,,
2017-11-10 00:00:00 UTC,"7 Stocks To Watch For November 10, 2017",NVDA,https://www.benzinga.com/news/earnings/17/11/10762736/7-stocks-to-watch-for-november-10-2017,Lisa Levin,,,,,,
2017-11-09 00:00:00 UTC,"From NVIDIA Q3 Earnings Conference Call: Pres, CEO Jen-Hsun Huang Says Over Longer-Term Crypto Is Small For Co., 'But Not 0.' Mgmt. Believes Crypto Will Be Around For Sometime, At Level 'Kind Of Like [Crypto Is] Today",NVDA,https://www.benzinga.com/news/17/11/10761619/from-nvidia-q3-earnings-conference-call-pres-ceo-jen-hsun-huang-says-over-longer,Paul Quintaro,,,,,,
2017-11-09 00:00:00 UTC,10 Stocks Moving In Thursday's After-Hours Session,NVDA,https://www.benzinga.com/news/17/11/10760747/10-stocks-moving-in-thursdays-after-hours-session,Brett Hershman,,,,,,
2017-11-09 00:00:00 UTC,Nvidia Raises Dividend From $0.14 To $0.15,NVDA,https://www.benzinga.com/trading-ideas/dividends/17/11/10760460/nvidia-raises-dividend-from-0-14-to-0-15,Paul Quintaro,,,,,,
2017-11-09 00:00:00 UTC,"Nvidia Reports Big Q3 Earnings Beat, Record Sales",NVDA,https://www.benzinga.com/news/earnings/17/11/10759997/nvidia-reports-big-q3-earnings-beat-record-sales,Brett Hershman,,,,,,
2017-11-09 00:00:00 UTC,"NVIDIA Sees Q4 Sales $2.65B +/- 2% vs $2.43B Est., Adj. Gross Margins ~60% +/- 50 Bps",NVDA,https://www.benzinga.com/news/guidance/17/11/10759806/nvidia-sees-q4-sales-2-65b-2-vs-2-43b-est-adj-gross-margins-60-50-bps,Paul Quintaro,,,,,,
2017-11-09 00:00:00 UTC,"NVIDIA Reports Q3 Adj. EPS $1.33 vs $0.94 Est., Sales $2.64B vs $2.36B Est.",NVDA,https://www.benzinga.com/news/earnings/17/11/10759748/nvidia-reports-q3-adj-eps-1-33-vs-0-94-est-sales-2-64b-vs-2-36b-est,Paul Quintaro,,,,,,
2017-11-09 00:00:00 UTC,Sizing Up The Sizzle In Semiconductor ETFs,NVDA,https://www.benzinga.com/analyst-ratings/analyst-color/17/11/10751561/sizing-up-the-sizzle-in-semiconductor-etfs,ETF Professor,,,,,,
2017-11-09 00:00:00 UTC,Nvidia Lower Heading Into Q3 Report,NVDA,https://www.benzinga.com/trading-ideas/technicals/17/11/10757784/nvidia-lower-heading-into-q3-report,Joel Elconin,,,,,,
2017-11-09 00:00:00 UTC,Why Cryptocurrency Investors Should Pay Attention To Nvidia's Earnings,NVDA,https://www.benzinga.com/short-sellers/17/11/10740450/why-cryptocurrency-investors-should-pay-attention-to-nvidias-earnings,Elizabeth Balboa,,,,,,
2017-11-09 00:00:00 UTC,"The Market In 5 Minutes: Adidas, Jobless Claims, And More",NVDA,https://www.benzinga.com/news/17/11/10755008/the-market-in-5-minutes-adiadas-jobless-claims-and-more,Benzinga Newsdesk,,,,,,
2017-11-09 00:00:00 UTC,Here's What's Coming Up On PreMarket Prep For November 9,NVDA,https://www.benzinga.com/trading-ideas/previews/17/11/10754183/heres-whats-coming-up-on-premarket-prep-for-november-9,Benzinga Newsdesk,,,,,,
2017-11-09 00:00:00 UTC,A Peek Into The Markets: U.S. Stock Futures Down Ahead Of Earnings,NVDA,https://www.benzinga.com/news/17/11/10753459/a-peek-into-the-markets-u-s-stock-futures-down-ahead-of-earnings,Lisa Levin,,,,,,
2017-11-09 00:00:00 UTC,"13 Stocks To Watch For November 9, 2017",NVDA,https://www.benzinga.com/news/earnings/17/11/10752978/13-stocks-to-watch-for-november-9-2017,Lisa Levin,,,,,,
2017-11-09 00:00:00 UTC,"Earnings Scheduled For November 9, 2017",NVDA,https://www.benzinga.com/news/earnings/17/11/10752866/earnings-scheduled-for-november-9-2017,Lisa Levin,,,,,,
2017-11-08 00:00:00 UTC,Expectations Mount For Nvidia; Analyst Raises Target To $190 Ahead Of Earnings,NVDA,https://www.benzinga.com/analyst-ratings/analyst-color/17/11/10747874/expectations-mount-for-nvidia-analyst-raises-target-to-,Shanthi Rexaline,,,,,,
2017-11-08 00:00:00 UTC,"Nvidia Q3 Earnings Preview: A Tale Of Outstanding Fundamentals, Pricey Stock",NVDA,https://www.benzinga.com/analyst-ratings/analyst-color/17/11/10730030/nvidia-q3-earnings-preview-a-tale-of-outstanding-fundam,Shanthi Rexaline,,,,,,
2017-11-08 00:00:00 UTC,"Hearing Stifel Earlier Highlighted Negative Implications For NVIDIA Related To AMD Deal With Intel, AMD GPU Head Joining Intel; Said Intel Is Building A GPU, Parallel Processor To Compete Against NVIDIA",NVDA,https://www.benzinga.com/analyst-ratings/analyst-color/17/11/10746892/hearing-stifel-earlier-highlighted-negative-implication,Paul Quintaro,,,,,,
2017-11-08 00:00:00 UTC,"Deutsche Bank Maintains Hold on NVIDIA, Raises Price Target to $190.00",NVDA,https://www.benzinga.com/news/17/11/10745943/deutsche-bank-maintains-hold-on-nvidia-raises-price-target-to-190-00,Paul Quintaro,,,,,,
2017-11-07 00:00:00 UTC,No One Compares To Intel In Global Semiconductor Market Share,NVDA,https://www.benzinga.com/general/education/17/11/10737537/no-one-compares-to-intel-in-global-semiconductor-market-share,Wayne Duggan,,,,,,
2017-11-07 00:00:00 UTC,What's Powering This Robotics ETF,NVDA,https://www.benzinga.com/trading-ideas/long-ideas/17/11/10732996/whats-powering-this-robotics-etf,ETF Professor,,,,,,
2017-11-07 00:00:00 UTC,Does The AMD-Intel Chip Deal Really Matter For Nvidia?,NVDA,https://www.benzinga.com/analyst-ratings/analyst-color/17/11/10738868/does-the-amd-intel-chip-deal-really-matter-for-nvidia,Wayne Duggan,,,,,,
2017-11-06 00:00:00 UTC,"The Week Ahead: Earnings Season Continues, Several IPOs, Notable Conferences On The Docket",NVDA,https://www.benzinga.com/news/17/11/10729239/the-week-ahead-earnings-season-continues-several-ipos-notable-conferences-on-the,Amy Weingarden,,,,,,
2017-11-06 00:00:00 UTC,An Intel Core Processor With Custom AMD Graphics Is Coming,NVDA,https://www.benzinga.com/news/17/11/10728854/an-intel-core-processor-with-custom-amd-graphics-is-coming,Jayson Derrick,,,,,,
