Date,Article_title,Stock_symbol,Url,Publisher,Author,Article,Lsa_summary,Luhn_summary,Textrank_summary,Lexrank_summary
2019-05-09 00:00:00 UTC,Key Day Shapes Up For Trade Talks But Earnings Also In Focus As Disney Results Gleaned,NVDA,https://www.benzinga.com/news/earnings/19/05/13704962/key-day-shapes-up-for-trade-talks-but-earnings-also-in-focus-as-disney-results-gleaned,JJ Kinahan,,,,,,
2019-05-09 00:00:00 UTC,"Red Hat Reports Expansion Of Alliance With NVIDIA To Accelerate, Scale AI/Machine Learning Workloads Across Hybrid Clouds, No Terms Disclosed",NVDA,https://www.benzinga.com/economics/19/05/13703407/red-hat-reports-expansion-of-alliance-with-nvidia-to-accelerate-scale-aimachine-learning-workloads-a,Benzinga Newsdesk,,,,,,
2019-05-08 00:00:00 UTC,Autonomous Driving Startup Drivent Comes Out Of Stealth Mode,NVDA,https://www.benzinga.com/news/19/05/13695794/autonomous-driving-startup-drivent-comes-out-of-stealth-mode,FreightWaves,,,,,,
2019-05-07 00:00:00 UTC,"Many stocks are trading lower amid continued uncertainty about the future of trade between the US and China, and concerns on U.S. sanctions on Iran and Venezuela.",NVDA,https://www.benzinga.com/markets/wiim/19/05/13683842/many-stocks-are-trading-lower-amid-continued-uncertainty-about-the-future-of-trade-between-the-us-an,Benzinga Newsdesk,,,,,,
2019-05-06 00:00:00 UTC,"Boeing, Caterpillar, Chipmakers Retreat After Trump Threats To Raise China Tariffs",NVDA,https://www.benzinga.com/news/earnings/19/05/13672789/boeing-caterpillar-chipmakers-retreat-after-trump-threats-to-raise-china-tariffs,JJ Kinahan,,,,,,
2019-05-06 00:00:00 UTC,Shares of several multinational companies are trading lower following a tweet from President Trump which hinted at additional tariffs on China and China indicated it may back out of upcoming trade negotiations.,NVDA,https://www.benzinga.com/markets/wiim/19/05/13672250/shares-of-several-multinational-companies-are-trading-lower-following-a-tweet-from-president-trump-w,Benzinga 窶丑ewsdesk,,,,,,
2019-05-02 00:00:00 UTC,"NVIDIA To Report Q1 Earnings On Thurs., May 16, 2019 After Market Close",NVDA,https://www.benzinga.com/news/earnings/19/05/13659473/nvidia-to-report-q1-earnings-on-thurs-may-16-2019-after-market-close,Benzinga Newsdesk,,,,,,
2019-05-01 00:00:00 UTC,"Analysts Impressed With AMD's Execution, Pipeline Following Solid Q1 Results",NVDA,https://www.benzinga.com/analyst-ratings/analyst-color/19/05/13640571/analysts-impressed-with-amds-execution-pipeline-following-solid-q1-results,Shanthi Rexaline,,,,,,
2019-04-30 00:00:00 UTC,Shares of several semi/microchip companies are trading higher after Advanced Micro Devices reported better-than-expected Q1 EPS and sales results.,NVDA,https://www.benzinga.com/markets/wiim/19/04/13632554/shares-of-several-semimicrochip-companies-are-trading-higher-after-advanced-micro-devices-reported-b,Benzinga Newsdesk,,,,,,
2019-04-30 00:00:00 UTC,"You're Entering the ""Show-Me State"" As Chip Firms Get Ready To Report",NVDA,https://www.benzinga.com/markets/cryptocurrency/19/04/13628035/youre-entering-the-show-me-state-as-chip-firms-get-ready-to-report,JJ Kinahan,,,,,,
2019-04-26 00:00:00 UTC,"Intel Guidance Disappoints, But Earnings Season Overall Has Surprised To Upside",NVDA,https://www.benzinga.com/news/earnings/19/04/13606309/intel-guidance-disappoints-but-earnings-season-overall-has-surprised-to-upside,JJ Kinahan,,,,,,
2019-04-26 00:00:00 UTC,Shares of several semiconductors and microchip stocks are trading lower in sympathy with Intel after it issued worse-than-expected Q2 and FY19 guidance.,NVDA,https://www.benzinga.com/markets/wiim/19/04/13605962/shares-of-several-semiconductors-and-microchip-stocks-are-trading-lower-in-sympathy-with-intel-after,Benzinga Newsdesk,,,,,,
2019-04-25 00:00:00 UTC,"AMD Shares Trading 1.7% Higher, NVIDIA Down 2.6%, Micron Down 2.4% Following Q1 Earnings And Q2 Guidance From Intel",NVDA,https://www.benzinga.com/news/earnings/19/04/13601461/amd-shares-trading-1-7-higher-nvidia-down-2-6-micron-down-2-4-following-q1-earnings-and-q2-guidance,Benzinga Newsdesk,,,,,,
2019-04-25 00:00:00 UTC,Shares of several companies in the semiconductor and microchip sector are trading lower after Xilinx reported Q4 earnings. Xilinx reported weakness in the data center and TME end markets.,NVDA,https://www.benzinga.com/markets/wiim/19/04/13599362/shares-of-several-companies-in-the-semiconductor-and-microchip-sector-are-trading-lower-after-xilinx,Benzinga Newsdesk,,,,,,
2019-04-25 00:00:00 UTC,Seeing Weakness In Several Semiconductor And Microchip Stocks; Susquehanna Analyst Christopher Rolland Tells Benzinga The Sector Is Weak On The Back Of Xilinx Earnings.,NVDA,https://www.benzinga.com/analyst-ratings/analyst-color/19/04/13599346/seeing-weakness-in-several-semiconductor-and-microchip-stocks-susquehanna-analyst-c,Benzinga Newsdesk,,,,,,
2019-04-25 00:00:00 UTC,"Big Chip Q1 Earnings Preview: A Focus On Industry Downturn, Product Delays, Competitive Dynamics, New Tech",NVDA,https://www.benzinga.com/analyst-ratings/analyst-color/19/04/13575584/big-chip-q1-earnings-preview-a-focus-on-industry-downturn-product-delays-competitiv,Shanthi Rexaline,,,,,,
2019-04-25 00:00:00 UTC,NVIDIA Option Alert: May 3 $187.5 Calls Sweep (3) near the Ask: 814 @ $3.951 vs 2432 OI; Earnings 5/9 After Close [est] Ref=$186.44,NVDA,https://www.benzinga.com/markets/options/19/04/13597964/nvidia-option-alert-may-3-187-5-calls-sweep-3-near-the-ask-814-3-951-vs-2432-oi-earnings-59-after,Charles Gross,,,,,,
2019-04-24 00:00:00 UTC,Shares of several microchip and semiconductor stocks are trading higher after Texas Instruments and Silicon Laboratories reported strong quarterly results.,NVDA,https://www.benzinga.com/markets/wiim/19/04/13587626/shares-of-several-microchip-and-semiconductor-stocks-are-trading-higher-after-texas-instruments-and,Benzinga Newsdesk,,,,,,
2019-04-23 00:00:00 UTC,Quarterhill's Wi-LAN Reports Polaris Innovations Subsidiary Granted Term License For Certain Patents Owned By Polaris To NVIDIA As Well As Options for NVIDIA To Renew Through Life Of Patents,NVDA,https://www.benzinga.com/news/19/04/13576762/quarterhills-wi-lan-reports-polaris-innovations-subsidiary-granted-term-license-for-certain-patents,Benzinga Newsdesk,,,,,,
2019-04-19 00:00:00 UTC,Another Electric Vehicle ETF Revs Up,NVDA,https://www.benzinga.com/trading-ideas/long-ideas/19/04/13564989/another-electric-vehicle-etf-revs-up,ETF Professor,,,,,,
2019-04-18 00:00:00 UTC,"Jim Cramer Shares His Thoughts On AMD, Gilead, Nvidia And More",NVDA,https://www.benzinga.com/media/19/04/13557755/jim-cramer-shares-his-thoughts-on-amd-gilead-nvidia-and-more,Craig Jones,,,,,,
2019-04-17 00:00:00 UTC,"Hot, Fresh Earnings On The Menu As Netflix, Morgan Stanley Results In Focus",NVDA,https://www.benzinga.com/news/earnings/19/04/13552161/hot-fresh-earnings-on-the-menu-as-netflix-morgan-stanley-results-in-focus,JJ Kinahan,,,,,,
2019-04-12 00:00:00 UTC,"DZ Bank Downgrades NVIDIA To Sell, Announces $170 Target",NVDA,https://www.benzinga.com/news/19/04/13529037/dz-bank-downgrades-nvidia-to-sell-announces-170-target,Benzinga_Newsdesk,,,,,,
2019-04-11 00:00:00 UTC,Ad Revenue Another Big Catalyst For The Esports ETF,NVDA,https://www.benzinga.com/trading-ideas/long-ideas/19/04/13519689/ad-revenue-another-big-catalyst-for-the-esports-etf,ETF Professor,,,,,,
2019-04-09 00:00:00 UTC,Seeing weakness in the microchip and semiconductor space. Not currently seeing any news to justify price action.,NVDA,https://www.benzinga.com/markets/wiim/19/04/13509297/seeing-weakness-in-the-microchip-and-semiconductor-space-not-currently-seeing-any-news-to-justify-pr,Benzinga Newsdesk,,,,,,
2019-04-03 00:00:00 UTC,"UPDATE: Nomura Initiates NVIDIA With Neutral, $147 Target As Firm Believes Co's Current Valuation Factors In Co's 'impressive history of developing new markets for its products, and the computing accelerator and automotive' Market Opportunities",NVDA,https://www.benzinga.com/analyst-ratings/analyst-color/19/04/13478833/update-nomura-initiates-nvidia-with-neutral-147-target-as-firm-believes-cos-current,Benzinga_Newsdesk,,,,,,
2019-04-03 00:00:00 UTC,"Nomura Initiates Coverage On Semi Stocks, Picks AMD And Intel As Winners",NVDA,https://www.benzinga.com/analyst-ratings/analyst-color/19/04/13478159/nomura-initiates-coverage-on-semi-stocks-picks-amd-and-,Wayne Duggan,,,,,,
2019-04-03 00:00:00 UTC,"Shares of several semiconductor companies are trading higher after a report stating AMD sales will increase ""sharply"" in the second half of 2019 given a ramp up in CPU and GPU shipments for notebooks, motherboards, and servers.",NVDA,https://www.benzinga.com/markets/wiim/19/04/13478318/shares-of-several-semiconductor-companies-are-trading-higher-after-a-rep,Benzinga Newsdesk,,,,,,
2019-04-03 00:00:00 UTC,"Benzinga's Top Upgrades, Downgrades For April 3, 2019",NVDA,https://www.benzinga.com/analyst-ratings/upgrades/19/04/13478002/benzingas-top-upgrades-downgrades-for-april-3-2019,Lisa Levin,,,,,,
2019-04-03 00:00:00 UTC,"Nomura Initiates Coverage On NVIDIA with Neutral Rating, Announces $147 Price Target",NVDA,https://www.benzinga.com/news/19/04/13476778/nomura-initiates-coverage-on-nvidia-with-neutral-rating-announces-147-price-targ,Vick Meyer,,,,,,
2019-04-01 00:00:00 UTC,Shares of several semiconductor stocks are trading higher following strong manufacturing data from China after a guidance warning by Infineon last week dragged the sector lower. Strength may also be related to news of a lower value-added tax in China and positive US manufacturing data.,NVDA,https://www.benzinga.com/markets/wiim/19/04/13460831/shares-of-several-semiconductor-stocks-are-trading-higher-following-stro,Benzinga Newsdesk,,,,,,
2019-04-01 00:00:00 UTC,"Stifel Nicolas Analyst Kevin Cassidy, When Asked About News Impacting Semiconductor Sector, Tells Benzinga, 'I think it's the news of lower VAT and positive PMI data for March'",NVDA,https://www.benzinga.com/analyst-ratings/analyst-color/19/04/13460730/stifel-nicolas-analyst-kevin-cassidy-when-asked-about-n,Benzinga Newsdesk,,,,,,
2019-03-31 00:00:00 UTC,NVIDIA's Director of Technical Marketing Tom 'TAP' Petersen Departs for Intel,NVDA,https://www.benzinga.com/news/19/03/13455364/nvidias-director-of-technical-marketing-tom-tap-petersen-departs-for-intel,Charles Gross,,,,,,
2019-03-26 00:00:00 UTC,Nvidia Gets Boost From Bullish Piper Jaffray Initiation,NVDA,https://www.benzinga.com/analyst-ratings/analyst-color/19/03/13425584/nvidia-gets-boost-from-bullish-piper-jaffray-initiation,Jayson Derrick,,,,,,
2019-03-26 00:00:00 UTC,"Benzinga's Top Upgrades, Downgrades For March 26, 2019",NVDA,https://www.benzinga.com/analyst-ratings/upgrades/19/03/13423832/benzingas-top-upgrades-downgrades-for-march-26-2019,Lisa Levin,,,,,,
2019-03-26 00:00:00 UTC,NVIDIA shares are trading higher after Piper Jaffray initiated coverage on the stock with an Overweight rating and announced a $200 price target.,NVDA,https://www.benzinga.com/markets/wiim/19/03/13422913/nvidia-shares-are-trading-higher-after-piper-jaffray-initiated-coverage-,Benzinga Newsdesk,,,,,,
2019-03-26 00:00:00 UTC,Piper Jaffray Sees Opportunity For NVIDIA To Significantly Expand Margins,NVDA,https://www.benzinga.com/analyst-ratings/analyst-color/19/03/13422094/piper-jaffray-sees-opportunity-for-nvidia-to-significan,Benzinga Newsdesk,,,,,,
2019-03-26 00:00:00 UTC,"PiperJaffray Initiates Coverage On NVIDIA with Overweight Rating, Announces $200 Price Target",NVDA,https://www.benzinga.com/news/19/03/13422036/piperjaffray-initiates-coverage-on-nvidia-with-overweight-rating-announces-200-p,Vick Meyer,,,,,,
2019-03-22 00:00:00 UTC,Shares of the overall market are trading lower after the yield curve inverted for the first time since 2007; some attribute this as a sign of the economy slowing.,NVDA,https://www.benzinga.com/markets/wiim/19/03/13411088/shares-of-the-overall-market-are-trading-lower-after-the-yield-curve-inv,Benzinga Newsdesk,,,,,,
2019-03-22 00:00:00 UTC,The Place To Be With Israel ETFs,NVDA,https://www.benzinga.com/trading-ideas/long-ideas/19/03/13406028/the-place-to-be-with-israel-etfs,ETF Professor,,,,,,
2019-03-22 00:00:00 UTC,Light Goes From Green To Red As Weak European Data Puts Brakes On U.S. Rally,NVDA,https://www.benzinga.com/news/earnings/19/03/13408593/light-goes-from-green-to-red-as-weak-european-data-puts-brakes-on-u-s-r,JJ Kinahan,,,,,,
2019-03-21 00:00:00 UTC,Shares of several semiconductor stocks are trading higher after Micron reported better-than-expected Q2 EPS and revenue; the company's CEO also stated they expect NAND bit supply growth in FY20 to be below industry demand.,NVDA,https://www.benzinga.com/markets/wiim/19/03/13402086/shares-of-several-semiconductor-stocks-are-trading-higher-after-micron-r,Benzinga Newsdesk,,,,,,
2019-03-20 00:00:00 UTC,"Sell-Side Largely Bullish On Nvidia, With Eye On Anticipated Second-Half Recovery",NVDA,https://www.benzinga.com/analyst-ratings/analyst-color/19/03/13394276/sell-side-largely-bullish-on-nvidia-with-eye-on-anticip,Shanthi Rexaline,,,,,,
2019-03-20 00:00:00 UTC,"Fed And FedEx: While Fed Meeting Dominates News, Don't Forget Trade Situation",NVDA,https://www.benzinga.com/news/earnings/19/03/13394636/fed-and-fedex-while-fed-meeting-dominates-news-dont-forget-trade-situat,JJ Kinahan,,,,,,
2019-03-20 00:00:00 UTC,70 Biggest Movers From Yesterday,NVDA,https://www.benzinga.com/news/19/03/13392482/70-biggest-movers-from-yesterday,Lisa Levin,,,,,,
2019-03-19 00:00:00 UTC,Samsung CEO Sees Intensified Competition in Chip Market Due to Oversupply,NVDA,https://www.benzinga.com/news/19/03/13391689/samsung-ceo-sees-intensified-competition-in-chip-market-due-to-oversupply,Charles Gross,,,,,,
2019-03-19 00:00:00 UTC,45 Stocks Moving In Tuesday's Mid-Day Session,NVDA,https://www.benzinga.com/news/19/03/13388164/45-stocks-moving-in-tuesdays-mid-day-session,Lisa Levin,,,,,,
2019-03-19 00:00:00 UTC,45 Stocks Moving In Tuesday's Mid-Day Session,NVDA,https://www.benzinga.com/news/19/03/13388052/45-stocks-moving-in-tuesdays-mid-day-session,Lisa Levin,,,,,,
2019-03-19 00:00:00 UTC,"AMD Analyst Says Cloud Gaming A Good Opportunity, But Stock Is 'Ahead Of Itself'",NVDA,https://www.benzinga.com/analyst-ratings/analyst-color/19/03/13386033/amd-analyst-says-cloud-gaming-a-good-opportunity-but-st,Shanthi Rexaline,,,,,,
2019-03-19 00:00:00 UTC,ON Semiconductor Collaborates With NVIDIA On Cloud-Based Autonomous Vehicle Simulation,NVDA,https://www.benzinga.com/tech/19/03/13387487/on-semiconductor-collaborates-with-nvidia-on-cloud-based-autonomous-vehicle-simu,Benzinga Newsdesk,,,,,,
2019-03-19 00:00:00 UTC,Analysts Dissect Nvidia's Product Announcements: 'Evolutionary Rather Than Game-Changing',NVDA,https://www.benzinga.com/analyst-ratings/analyst-color/19/03/13385418/analysts-dissect-nvidias-product-announcements-evolutio,Shanthi Rexaline,,,,,,
2019-03-19 00:00:00 UTC,NVIDIA shares are trading higher after the company teamed up with Amazon Web Services IoT to bring AI to millions of connected devices.,NVDA,https://www.benzinga.com/markets/wiim/19/03/13386543/nvidia-shares-are-trading-higher-after-the-company-teamed-up-with-amazon,Benzinga Newsdesk,,,,,,
2019-03-19 00:00:00 UTC,NVIDIA Teams with Amazon Web Services to Bring AI to Millions of Connected Devices,NVDA,https://www.benzinga.com/news/19/03/13383556/nvidia-teams-with-amazon-web-services-to-bring-ai-to-millions-of-connected-devic,Charles Gross,,,,,,
2019-03-15 00:00:00 UTC,Shares of several semiconductor companies are trading higher after Broadcom reported better-than-expected Q1 EPS and issued strong FY19 guidance.,NVDA,https://www.benzinga.com/markets/wiim/19/03/13368371/shares-of-several-semiconductor-companies-are-trading-higher-after-broad,Benzinga Newsdesk,,,,,,
2019-03-14 00:00:00 UTC,Pro: Nvidia's Stock At A Tipping Point,NVDA,https://www.benzinga.com/analyst-ratings/analyst-color/19/03/13361371/pro-nvidias-stock-at-a-tipping-point,Jayson Derrick,,,,,,
2019-03-14 00:00:00 UTC,Global Barometer: Oracle Earnings Could Provide Insight On Economy,NVDA,https://www.benzinga.com/news/earnings/19/03/13360722/global-barometer-oracle-earnings-could-provide-insight-on-economy,JJ Kinahan,,,,,,
2019-03-14 00:00:00 UTC,China Might Take Some Starch Out of U.S. Rally With More Weak Economic Data,NVDA,https://www.benzinga.com/news/earnings/19/03/13360307/china-might-take-some-starch-out-of-u-s-rally-with-more-weak-economic-d,JJ Kinahan,,,,,,
2019-03-12 00:00:00 UTC,What's Next For Nvidia And Mellanox?,NVDA,https://www.benzinga.com/analyst-ratings/analyst-color/19/03/13345756/whats-next-for-nvidia-and-mellanox,Jayson Derrick,,,,,,
2019-03-12 00:00:00 UTC,"Starboard Value Comments Following News Of NVIDIA Offer To Mellanox, Says Has Sold Its Entire Position In Mellanox",NVDA,https://www.benzinga.com/news/19/03/13346886/starboard-value-comments-following-news-of-nvidia-offer-to-mellanox-says-has-sol,Benzinga Newsdesk,,,,,,
2019-03-12 00:00:00 UTC,"Brexit Time Again: As Parliament Votes, U.S. Stocks Have Mixed Tone With Boeing Down",NVDA,https://www.benzinga.com/news/earnings/19/03/13343571/brexit-time-again-as-parliament-votes-u-s-stocks-have-mixed-tone-with-b,JJ Kinahan,,,,,,
2019-03-12 00:00:00 UTC,50 Biggest Movers From Yesterday,NVDA,https://www.benzinga.com/news/19/03/13340970/50-biggest-movers-from-yesterday,Lisa Levin,,,,,,
2019-03-11 00:00:00 UTC,The Early Reaction To Nvidia's Acquisition Of Mellanox,NVDA,https://www.benzinga.com/analyst-ratings/analyst-color/19/03/13335715/the-early-reaction-to-nvidias-acquisition-of-mellanox,Jayson Derrick,,,,,,
2019-03-11 00:00:00 UTC,Mid-Afternoon Market Update: Crude Oil Up 1.2%; Yatra Online Shares Spike Higher,NVDA,https://www.benzinga.com/news/19/03/13337525/mid-afternoon-market-update-crude-oil-up-1-2-yatra-online-shares-spike-higher,Lisa Levin,,,,,,
2019-03-11 00:00:00 UTC,40 Stocks Moving In Monday's Mid-Day Session,NVDA,https://www.benzinga.com/news/19/03/13335538/40-stocks-moving-in-mondays-mid-day-session,Lisa Levin,,,,,,
2019-03-11 00:00:00 UTC,Mid-Day Market Update: NASDAQ Rises Over 100 Points; Axovant Sciences Shares Surge,NVDA,https://www.benzinga.com/news/19/03/13335526/mid-day-market-update-nasdaq-rises-over-100-points-axovant-sciences-shares-surge,Lisa Levin,,,,,,
2019-03-11 00:00:00 UTC,NVIDIA shares are trading higher after the company announced it will acquire Mellanox Technologies for $6.9 billion.,NVDA,https://www.benzinga.com/markets/wiim/19/03/13335107/nvidia-shares-are-trading-higher-after-the-company-announced-it-will-acq,Benzinga Newsdesk,,,,,,
2019-03-11 00:00:00 UTC,Mid-Morning Market Update: Markets Mostly Higher; Nvidia To Buy Mellanox Technologies For $6.9B,NVDA,https://www.benzinga.com/news/19/03/13334923/mid-morning-market-update-markets-mostly-higher-nvidia-to-buy-mellanox-technolog,Lisa Levin,,,,,,
2019-03-11 00:00:00 UTC,"From NVIDIA Call To Discuss Mellanox Purchase: CFO Says Mgmt. To Focus Rest Of Calendar Year To Close Deal, Notes Approval In US, China Still Needed",NVDA,https://www.benzinga.com/news/19/03/13334148/from-nvidia-call-to-discuss-mellanox-purchase-cfo-says-mgmt-to-focus-rest-of-cal,Benzinga Newsdesk,,,,,,
2019-03-11 00:00:00 UTC,Nvidia To Buy Mellanox Technologies For $6.9B,NVDA,https://www.benzinga.com/news/19/03/13333915/nvidia-to-buy-mellanox-technologies-for-6-9b,Jayson Derrick,,,,,,
2019-03-11 00:00:00 UTC,A Peek Into The Markets: Boeing Leads Dow Futures Lower,NVDA,https://www.benzinga.com/news/19/03/13333477/a-peek-into-the-markets-boeing-leads-dow-futures-lower,Lisa Levin,,,,,,
2019-03-11 00:00:00 UTC,Mellanox to be Acquired by NVIDIA for $125/Share Cash,NVDA,https://www.benzinga.com/news/19/03/13333363/mellanox-to-be-acquired-by-nvidia-for-125share-cash,Benzinga Newsdesk,,,,,,
2019-03-11 00:00:00 UTC,"7 Stocks To Watch For March 11, 2019",NVDA,https://www.benzinga.com/news/earnings/19/03/13332880/7-stocks-to-watch-for-march-11-2019,Lisa Levin,,,,,,
2019-03-10 00:00:00 UTC,Nvidia Near Deal to Acquire Mellanox Technologies for $7B+ in Cash,NVDA,https://www.benzinga.com/news/19/03/13332506/nvidia-near-deal-to-acquire-mellanox-technologies-for-7b-in-cash,Charles Gross,,,,,,
2019-03-08 00:00:00 UTC,Do You Love Cult Stocks?,NVDA,https://www.benzinga.com/markets/cryptocurrency/19/03/13283831/do-you-love-cult-stocks,Wayne Duggan,,,,,,
2019-03-07 00:00:00 UTC,'Global semiconductor market dips for first time in 30 months; Shrinking demand from data centers and China blamed for decline' -Nikkei Asian Review,NVDA,https://www.benzinga.com/news/19/03/13321031/global-semiconductor-market-dips-for-first-time-in-30-months-shrinking-demand-fr,Benzinga Newsdesk,,,,,,
2019-03-06 00:00:00 UTC,Semiconductor Industry Association Reports 7.2% Decline in Global Chip Sales in January,NVDA,https://www.benzinga.com/news/19/03/13307287/semiconductor-industry-association-reports-7-2-decline-in-global-chip-sales-in-j,Charles Gross,,,,,,
2019-02-25 00:00:00 UTC,"As Trade Optimism Grows, Markets Turn Green and Boeing, Caterpillar Among Leaders",NVDA,https://www.benzinga.com/news/earnings/19/02/13236263/as-trade-optimism-grows-markets-turn-green-and-boeing-caterpillar-among,JJ Kinahan,,,,,,
2019-02-23 00:00:00 UTC,"Barron's Picks And Pans: Apple, Altria, Micron Technology, Nvidia And More",NVDA,https://www.benzinga.com/media/19/02/13232574/barrons-picks-and-pans-apple-altria-micron-technology-nvidia-and-more,Nelson Hem,,,,,,
2019-02-22 00:00:00 UTC,Why This Analyst Sees 25% Upside In NVIDIA,NVDA,https://www.benzinga.com/analyst-ratings/analyst-color/19/02/13228305/why-this-analyst-sees-25-upside-in-nvidia,Jayson Derrick,,,,,,
2019-02-22 00:00:00 UTC,"UPDATE: Atlantic Equities Initiates NVIDIA With Overweight And A $195 Target As Firm Believes 'the headwinds are transitory and growth should re-accelerate given underlying fundamentals, leaving the recent sell-off creating an attractive entry point'",NVDA,https://www.benzinga.com/analyst-ratings/analyst-color/19/02/13229210/update-atlantic-equities-initiates-nvidia-with-overweig,Benzinga_Newsdesk,,,,,,
2019-02-22 00:00:00 UTC,"Atlantic Equities Initiates Coverage On NVIDIA with Overweight Rating, Announces $195 Price Target",NVDA,https://www.benzinga.com/news/19/02/13227909/atlantic-equities-initiates-coverage-on-nvidia-with-overweight-rating-announces-,Benzinga_Newsdesk,,,,,,
2019-02-19 00:00:00 UTC,An Electric Outlook For The Esports ETF,NVDA,https://www.benzinga.com/analyst-ratings/analyst-color/19/02/13196303/an-electric-outlook-for-the-esports-etf,ETF Professor,,,,,,
2019-02-15 00:00:00 UTC,"Nvidia Shares Up After Earnings, But A Weak Recovery Does Not Bode Well For The Chart",NVDA,https://www.benzinga.com/19/02/13190738/nvidia-shares-up-after-earnings-but-a-weak-recovery-does-not-bode-well-for-the-chart,Steve Miller,,,,,,
2019-02-15 00:00:00 UTC,52 Stocks Moving In Friday's Mid-Day Session,NVDA,https://www.benzinga.com/news/19/02/13189924/52-stocks-moving-in-fridays-mid-day-session,Lisa Levin,,,,,,
2019-02-15 00:00:00 UTC,"Benzinga Pro's Top 10 Most-Searched Tickers For Afternoon Of Fri., Feb. 15, 2019",NVDA,https://www.benzinga.com/news/19/02/13189921/benzinga-pros-top-10-most-searched-tickers-for-afternoon-of-fri-feb-15-2019,Benzinga Newsdesk,,,,,,
2019-02-15 00:00:00 UTC,Analysts: Nvidia Needs A Big Second Half Of 2019,NVDA,https://www.benzinga.com/analyst-ratings/analyst-color/19/02/13189415/analysts-nvidia-needs-a-big-second-half-of-2019,Wayne Duggan,,,,,,
2019-02-15 00:00:00 UTC,"Benzinga Pro's Top 10 Most-Searched Tickers For Morning Of Fri., Feb. 15, 2019",NVDA,https://www.benzinga.com/news/19/02/13188293/benzinga-pros-top-10-most-searched-tickers-for-morning-of-fri-feb-15-2019,Benzinga Newsdesk,,,,,,
2019-02-15 00:00:00 UTC,31 Stocks Moving In Friday's Pre-Market Session,NVDA,https://www.benzinga.com/news/19/02/13187641/31-stocks-moving-in-fridays-pre-market-session,Lisa Levin,,,,,,
2019-02-15 00:00:00 UTC,NVIDIA shares are trading higher after the company said it expects 2020 revenue to be roughly the same as 2019 while analysts expected a revenue drop.,NVDA,https://www.benzinga.com/markets/wiim/19/02/13187568/nvidia-shares-are-trading-higher-after-the-company-said-it-expects-2020-,Benzinga 窶丑ewsdesk,,,,,,
2019-02-15 00:00:00 UTC,A Peek Into The Markets: US Stock Futures Edge Higher Ahead Of Economic Reports,NVDA,https://www.benzinga.com/news/19/02/13187126/a-peek-into-the-markets-us-stock-futures-edge-higher-ahead-of-economic-reports,Lisa Levin,,,,,,
2019-02-15 00:00:00 UTC,"UPDATE: Loup's Munster Sees NVIDIA Shares Being 'range bound in the coming months, as investors will likely trim revenue expectations'",NVDA,https://www.benzinga.com/analyst-ratings/analyst-color/19/02/13186696/update-loups-munster-sees-nvidia-shares-being-range-bou,Benzinga Newsdesk,,,,,,
2019-02-15 00:00:00 UTC,Loup Ventures' Gene Munster On NVIDIA Results: 'While we are believers in the Nvidia story...we believe that there remains risk to FY20 guidance',NVDA,https://www.benzinga.com/analyst-ratings/analyst-color/19/02/13186687/loup-ventures-gene-munster-on-nvidia-results-while-we-a,Benzinga Newsdesk,,,,,,
2019-02-15 00:00:00 UTC,"10 Stocks To Watch For February 15, 2019",NVDA,https://www.benzinga.com/news/earnings/19/02/13186340/10-stocks-to-watch-for-february-15-2019,Lisa Levin,,,,,,
2019-02-14 00:00:00 UTC,7 Stocks Moving In Thursday's After-Hours Session,NVDA,https://www.benzinga.com/news/19/02/13182618/7-stocks-moving-in-thursdays-after-hours-session,Brett Hershman,,,,,,
2019-02-14 00:00:00 UTC,Nvidia Shares Spike Higher Following Q4 Earnings Beat,NVDA,https://www.benzinga.com/news/earnings/19/02/13181546/nvidia-shares-spike-higher-following-q4-earnings-beat,Brett Hershman,,,,,,
2019-02-14 00:00:00 UTC,"NVIDIA Q4 EPS $0.80 vs $0.75 Reuters Estimate, Sales $2.21B Beat $2.2B Reuters Estimate",NVDA,https://www.benzinga.com/news/earnings/19/02/13181393/nvidia-q4-eps-0-80-vs-0-75-reuters-estimate-sales-2-21b-miss-2-2b-reute,Benzinga Newsdesk,,,,,,
